[
  {
    "alteration_package_application_id": "2d200d5c-477c-4c90-b305-e8f445f4d8e5",
    "organization_id": "00000000-0000-0000-0000-000000000001",
    "created_at": "2026-01-28T09:17:05.101Z",
    "created_by": {
      "type": "api_key",
      "id": "420df14d-b09d-4d89-84a8-8e3118c9ca23",
      "owner_id": "00000000-0000-0000-0000-000000000001"
    },
    "module": {
      "package_name": "Funeral Cover",
      "suggested_premium": 17500,
      "base_premium": 16000,
      "cover_amount": 25000000
    },
    "monthly_premium": 17500,
    "currency": "ZAR",
    "sum_assured": 25000000,
    "billing_frequency": "monthly",
    "status": "pending",
    "change_description": "Updating cover amount before issuing policy",
    "input_data": {
      "cover_amount": 25000000,
      "spouse_cover": true
    },
    "application_id": "bf1ada91-eecb-4f47-9bfa-1258bb1e0055",
    "alteration_hook_key": "update_cover_amount"
  }
]